title,views,likes,comments,upload time
Was Fridays For Future bisher erreicht hat | #analyse,379694,18577,4829,2019-10-02T13:00:10Z
'Fridays For Future hat auch beunruhigende Tendenzen angenommen' | Philipp Möller im Interview,83149,1304,632,2019-10-01T13:59:47Z
Schockiert vom Hass: Warum Fridays for Hubraum dicht machte,69918,749,797,2019-09-27T14:12:03Z
FRIDAYS FOR FUTURE: Greta fast allein in New York,61758,412,0,2019-08-31T11:56:14Z
Fridays for Future: unterwandert von Linksextremen,54535,6874,555,2019-10-08T13:10:27Z
FRIDAYS FOR FUTURE: Greta Thunberg in New York eingetroffen,40543,316,0,2019-08-28T21:00:24Z
Fridays For Future: Proteste in Aachen und am Tagebau Garzweiler,35431,1086,845,2019-06-21T10:30:00Z
Fridays for Future-Sommerkongress: Planen für die Zukunft,33551,1180,685,2019-08-01T13:35:55Z
Erneut weltweite Klimaproteste von Fridays for Future,29972,973,740,2019-11-29T11:45:01Z
Fridays For Future: Klima retten um jeden Preis? | Auf den Punkt,28198,191,337,2019-09-24T15:21:55Z
Fridays for Future stellt neuen Demo-Rekord in Freiburg auf,25654,464,964,2019-09-20T15:41:45Z
FRIDAYS FOR FUTURE: Junge Klimaschützer stürmen voran - Politik stolpert hinterher,21957,201,0,2019-09-20T11:40:29Z
FRIDAYS FOR FUTURE: Greta Thunberg mit Alternativen Nobelpreis geehrt,21407,208,0,2019-09-25T11:21:55Z
FRIDAYS FOR FUTURE: Greta Thunberg auf Weg in die USA ist im Zeitplan,20414,144,0,2019-08-22T10:23:23Z
Wie geht es weiter mit „Fridays for Future“? - LIVE vom Sommercamp,15814,380,389,2019-08-03T14:28:04Z
FRIDAYS FOR FUTURE: Bei jungen Klima-Aktivisten hängt der Haussegen schief,13465,154,0,2019-08-09T11:15:11Z
FRIDAYS FOR FUTURE: Tausende Schüler treffen sich in Aachen zur Klimademo,12144,146,0,2019-06-21T11:14:42Z
FRIDAYS FOR FUTURE: Weltweite Klimaproteste - Politik reagiert zögerlich,8771,123,0,2019-09-21T07:14:37Z
WELT THEMA:  Fridays for Future - Mega-Demo für Wende in der Klimapolitik,6896,139,0,2019-06-21T09:10:55Z
"FRIDAYS FOR FUTURE WIRKT: Konstanz ruft ""Klimanotstand"" aus",6703,177,0,2019-05-03T14:58:51Z
"Vorwürfe an ""Fridays for Future"" - und die Antworten",6170,67,27,2019-05-23T17:33:37Z
Debatte um Klimaschutz: Fridays for Future Aktivisten bei Umweltministerkonferenz,5445,105,66,2019-11-15T13:50:33Z
FRIDAYS FOR FUTURE - #voteclimate #globalstrike - Energy saving - KLIMAWAHL,5160,308,20,2019-05-22T04:57:45Z
Klima retten fordert Opfer... | Fridays For Future,5093,367,181,2019-12-29T17:00:02Z
FRIDAYS FOR FUTURE - DEMO AACHEN - #schoolstrike4climate #fridaysforfuture #ac2106 - SHORTFILM,4476,310,207,2019-06-15T11:00:01Z
"Klima: Sarah Schmidt zur ""Fridays-For-Future""-Demo vor dem Bundeskanzleramt am 20.09.19",4125,34,0,2019-09-20T11:26:04Z
Fridays for future: Schaltgespräch mit Cosima Gill am 21.06.19,3706,73,0,2019-06-21T12:49:49Z
Klimaschutz muss kein Horror sein! | Fridays For Future,3328,280,48,2019-12-28T17:00:14Z
„Fridays For Future“- Demo startet am Flughafen Düsseldorf,3279,35,0,2019-08-23T12:41:13Z
Trotz Schulferien: „Fridays for Future“-Protest in Dortmund,2789,36,0,2019-08-02T15:02:24Z
"""Das Ende der Welt verhindern"" - Fridays for Future Sommerkongress in Dortmund",2664,54,45,2019-08-02T11:54:05Z
"Interview mit den ""Fridays for Future""-Aktivisten Maya Krieg und Luca Samlidid am 17.06.19",2526,22,0,2019-06-17T12:20:34Z
Wie rettet man die Welt? | Fridays For Future,2418,227,68,2019-12-30T17:00:20Z
"Fridays for Future: In Zukunft ""ein bisschen radikaler""",2369,47,147,2019-08-04T17:22:53Z
Schlechtes Gewissen für Fluggäste: Fridays for Future am Flughafen,2069,46,99,2019-07-26T17:28:46Z
Aktivist:innen | Ich will DRUCK machen! (Fridays for Future),1903,40,33,2019-08-14T15:42:10Z
"Klima: phoenix-Reporterin Sarah Schmidt u.a. zu den ""Fridays For Future""-Demos in Berlin am 20.09.19",1805,24,0,2019-09-20T08:57:02Z
Fridays for Future: Klimademo zieht durch Oldenburg,1753,17,29,2019-11-29T13:36:10Z
Zehntausende bei Fridays for Future: Europawahl ist Klimawahl,1689,22,24,2019-05-26T22:06:26Z
Fridays for Future kennt keine Ferien,1666,35,0,2019-06-29T08:38:32Z
"Tausende Lipper setzen bei den ""Fridays for Future""-Demos ein Zeichen",1664,19,3,2019-09-20T15:53:06Z
"""Fridays for Future“: Klimademo am Heldenplatz",1497,12,0,2019-10-04T11:37:38Z
Fridays for Future Schweinfurt 24.05.2019,1449,0,17,2019-05-24T17:20:43Z
+++ Die heimlichen Finanziers von Fridays for Future und Co +++,1424,69,10,2019-10-04T13:22:16Z
"""Fridays for Future"": Wem vertrauen die 14- bis 22-Jährigen?",1287,32,38,2019-08-16T17:05:38Z
Fridays for Future: Salzburger gehen fürs Klima auf die Straße,1134,0,0,2019-05-24T15:51:38Z
Freie Wähler vs. Fridays for Future: Klimaschutz in Stuttgart,1090,8,0,2019-05-16T10:59:28Z
Instagram-Story zur Fridays-for-Future Demo,894,8,2,2019-09-23T17:01:39Z
Fridays for Future am Black Friday,852,18,0,2019-11-29T18:18:29Z
LIVE: Fridays for Future Demo in Berlin,821,11,7,2019-09-20T12:28:19Z
Fridays for Future,817,12,17,2019-07-15T15:02:30Z
Cedric Hoyer von Fridays for Future auf der Uniper- Hauptversammlung,807,8,0,2019-05-22T13:57:31Z
Keine Ferien für Klimakämpfer: Fridays for Future in Dortmund,796,21,25,2019-08-02T16:13:12Z
"""Fridays for Future"" und Klimakabinett: Bringen sie endlich Veränderung?",772,17,8,2019-09-19T10:05:45Z
Klimastreik in SH: Studenten unterstützen Fridays for Future,680,21,3,2019-11-29T12:20:16Z
Fridays For Future: Weltweite Klimaproteste,654,4,0,2019-09-20T10:39:33Z
Fridays for Future-Demo in Nellingen,631,9,7,2019-07-12T14:52:56Z
"""Fridays for Future"" macht keine Sommerpause",573,10,1,2019-07-26T12:31:45Z
Fridays for future-Demos: Fulda beteiligt sich mit rund 800 Menschen,572,16,10,2019-09-20T14:41:47Z
"""Fridays for Future"": 6.000 Teilnehmer*innen bei Klima-Demo in Münster",570,15,0,2019-05-24T20:24:54Z
"Ein Jahr ""Fridays for Future"" - was hat sich geändert?",548,8,1,2019-11-22T10:06:43Z
Fridays for future: Balinger demonstrieren mittags,505,11,1,2019-05-24T15:52:55Z
Fridays for Future: Kölner Organisator Jan Tecklenburg im Interview,498,0,1,2019-11-30T07:09:26Z
Aufruf zum weltweiten Streik 24.5 von Fridays for Future,485,23,4,2019-05-22T13:08:15Z
Fridays for Future - Aufruf zum Globalen Klimastreik | Josephine Hübner | 85. Netzpolitischer Abend,402,4,3,2019-10-25T13:20:57Z
Weltweit koordinierte Klimaprosteste von Fridays for Future,396,15,11,2019-11-29T22:20:10Z
Fridays for Future: 100 Demonstranten in Cloppenburg,385,6,1,2019-11-29T17:14:08Z
Fridays for Future - erneut Schülerstreiks in 120 Ländern,384,16,9,2019-05-26T21:45:05Z
"""Fridays for Future"" Kundgebung vor Mainzer Rathaus",361,9,1,2019-08-28T15:44:50Z
Greta Thunberg - Die Kämpferin | ZDF Auslandsjournal 27.09.19 | fridays for future,335,6,0,2019-09-28T12:48:52Z
Jana macht Werbung für den 24.5 und 21.6 Fridays for Future Köln und Aachen,304,7,0,2019-05-20T07:14:43Z
Fridays for Future zu Gast bei rockradio.de (14.07.2019),303,9,9,2019-07-15T08:24:21Z
Fridays For Future - offenes Plenum,297,10,1,2019-10-07T14:07:26Z
Aufruf zum internationalen Fridays for Future Streik am 24.5.19,295,15,0,2019-05-22T15:49:42Z
Trotz Schulferien: Fridays for Future-Demo in Dortmund | AFP,248,2,0,2019-08-02T14:36:58Z
Fridays for Future: Vollzeit-Einsatz für Klimaschutz,239,6,0,2019-07-05T16:21:35Z
"""Fridays for Future"" demonstrieren am Stuttgarter Flughafen | AFP",227,3,0,2019-07-26T18:14:31Z
Stoppt Greta und Fridays For Future,202,5,0,2019-08-03T17:54:32Z
Fridays for Future Demonstration am 29. November 2019 in Köln,194,0,0,2019-11-30T08:39:48Z
Black Friday die große Verarsche !! - Fridays for Future,190,5,0,2019-11-30T23:32:34Z
Rede bei Fridays for Future in Berlin am 5.4.2019,185,0,0,2019-10-03T11:00:06Z
Friday for Future Global - 20. September 2019,172,5,1,2019-09-20T18:12:03Z
Levi aus Essen Friday’s for Future Demo gegen RWE 3.5.19,166,6,0,2019-05-05T19:26:48Z
Demozug Friday’s for Future Demo gegen RWE 3.5.19,164,6,0,2019-05-05T08:02:37Z
Rede einer Schülerin Friday’s for Future Demo gegen RWE 3.5.19,155,10,0,2019-05-05T07:53:10Z
Fridays for future & mehr | oeins aktuell | 22.11.2019,138,3,0,2019-12-02T17:00:15Z
RTF.1 Nachrichten: Weihnachtsdemo von Fridays for Future,137,7,2,2019-12-20T16:47:20Z
Internationale Großdemo von Fridays for Future in Aachen | AFP,135,0,0,2019-06-21T13:57:19Z
Internationale Großdemo von Fridays for Future in Aachen | AFP,135,0,0,2019-06-21T13:57:19Z
Horst Förster: Bei Fridays for Future geht es um die Rettung des Planeten - glaubt man.,124,8,0,2019-05-09T13:24:52Z
Fridays For Future-Aktionscamp,114,3,1,2019-10-14T15:41:20Z
Fridays for Future: CO2 Steuer ist guter Anfang,104,6,0,2019-07-13T09:04:10Z
Fridays for Aufklärung - Wie die Geschichte über Fridays for Future urteilen wird,89,0,0,2019-12-13T11:00:01Z
Fridays for Future - 15.03.2019,69,5,0,2019-09-11T16:49:26Z
Geht der Bürgerentscheid baden? Fridays for Future kämpft für Kohle-Aus in München,62,1,1,2019-07-12T16:09:04Z
Fridays for Future - globaler Klimastreik 20.09.2019,45,5,0,2019-09-22T19:08:41Z
"Horst Förster: Fridays for Future: ""Dort wird keine andere Meinung zugelassen!""",44,3,0,2019-05-09T13:19:49Z
Demo gegen Gewerbepark Fils - Nina von Friday For Future,39,2,0,2019-10-15T06:04:53Z
Fridays For Future - 23.07.2019,27,1,0,2019-09-17T09:34:05Z
"Fridays For Future, Stuttgart, 20.09.2019, Band: Actio Grenzänger (1)",17,0,0,2019-09-22T15:21:47Z
